{
  "schemaVersion": 1,
  "id": "videoml/scene-snapshot",
  "version": "1",
  "parametersSchema": {
    "type": "object",
    "additionalProperties": false,
    "required": [
      "sourceSceneId",
      "sourceFrame"
    ],
    "properties": {
      "sourceSceneId": {
        "type": "string",
        "minLength": 1
      },
      "sourceFrame": {
        "type": "integer",
        "minimum": 0,
        "maximum": 9007199254740991
      }
    }
  },
  "sceneInputs": [
    {
      "sceneIdParameter": "sourceSceneId",
      "frameParameter": "sourceFrame"
    }
  ]
}
